CREATE TABLE EMPLOYEE(SSN INTEGER PRIMARY KEY, NAME VARCHAR(20), DEPARTMENT VARCHAR(10));

Table created.

CREATE TABLE PROJECT(P_NO INTEGER PRIMARY KEY, DOMAIN VARCHAR(20));

Table created.

CREATE TABLE WORKSON(P_NO INTEGER, SSN INTEGER, FOREIGN KEY(SSN) REFERENCES EMPLOYEE(SSN), FOREIGN KEY(P_NO) REFERENCES PROJECT(P_NO));  

Table created.

ALTER TABLE EMPLOYEE DROP COLUMN DEPARTMENT;

Table altered.

DESC EMPLOYEE
 Name					   Null?    Type
 ----------------------------------------- -------- ----------------------------
 SSN					   NOT NULL NUMBER(38)
 NAME						    VARCHAR2(20)

ALTER TABLE EMPLOYEE ADD DEPT_NO NUMBER(3);

Table altered.

DESC EMPLOYEE
 Name					   Null?    Type
 ----------------------------------------- -------- ----------------------------
 SSN					   NOT NULL NUMBER(38)
 NAME						    VARCHAR2(20)
 DEPT_NO					    NUMBER(3)

INSERT INTO EMPLOYEE VALUES(1,'NAME1',1);

1 row created.

INSERT INTO EMPLOYEE VALUES(2,'NAME2',2);

1 row created.

INSERT INTO EMPLOYEE VALUES(3,'NAME3',3);

1 row created.

INSERT INTO EMPLOYEE VALUES(4,'NAME4',4);

1 row created.

INSERT INTO EMPLOYEE VALUES(5,'NAME5',5);

1 row created.

INSERT INTO PROJECT VALUES(1,'DATABASE');

1 row created.

INSERT INTO PROJECT VALUES(2,'DATABASE');

1 row created.

INSERT INTO PROJECT VALUES(3,'CLOUD');

1 row created.

INSERT INTO PROJECT VALUES(4,'DATABASE');

1 row created.

INSERT INTO PROJECT VALUES(5,'CLOUD');

1 row created.

INSERT INTO WORKSON VALUES(1,1);

1 row created.

INSERT INTO WORKSON VALUES(1,2);

1 row created.

INSERT INTO WORKSON VALUES(1,4);

1 row created.

INSERT INTO WORKSON VALUES(2,2);

1 row created.

INSERT INTO WORKSON VALUES(2,3);

1 row created.

INSERT INTO WORKSON VALUES(3,3);

1 row created.

INSERT INTO WORKSON VALUES(3,4);

1 row created.

INSERT INTO WORKSON VALUES(3,5);

1 row created.

INSERT INTO WORKSON VALUES(4,1);

1 row created.

INSERT INTO WORKSON VALUES(4,2);

1 row created.

INSERT INTO WORKSON VALUES(4,3);

1 row created.

INSERT INTO WORKSON VALUES(5,1);

1 row created.

INSERT INTO WORKSON VALUES(5,4);

1 row created.

INSERT INTO WORKSON VALUES(5,5);

1 row created.

SELECT * FROM EMPLOYEE;

       SSN NAME 		   DEPT_NO
---------- -------------------- ----------
	 1 NAME1			 1
	 2 NAME2			 2
	 3 NAME3			 3
	 4 NAME4			 4
	 5 NAME5			 5

SELECT * FROM PROJECT;

      P_NO DOMAIN
---------- --------------------
	 1 DATABASE
	 2 DATABASE
	 3 CLOUD
	 4 DATABASE
	 5 CLOUD

SELECT * FROM WORKSON;

      P_NO	  SSN
---------- ----------
	 1	    1
	 1	    2
	 1	    4
	 2	    2
	 2	    3
	 3	    3
	 3	    4
	 3	    5
	 4	    1
	 4	    2
	 4	    3

      P_NO	  SSN
---------- ----------
	 5	    1
	 5	    4
	 5	    5

14 rows selected.

      SELECT EMPLOYEE.SSN, NAME, DEPT_NO, PROJECT.P_NO, DOMAIN  FROM EMPLOYEE, PROJECT, WORKSON WHERE EMPLOYEE.SSN = WORKSON.SSN AND PROJECT.P_NO = WORKSON.P_NO AND PROJECT.DOMAIN = 'DATABASE';

       SSN NAME 		   DEPT_NO	 P_NO DOMAIN
---------- -------------------- ---------- ---------- --------------------
	 1 NAME1			 1	    4 DATABASE
	 1 NAME1			 1	    1 DATABASE
	 2 NAME2			 2	    4 DATABASE
	 2 NAME2			 2	    2 DATABASE
	 2 NAME2			 2	    1 DATABASE
	 3 NAME3			 3	    4 DATABASE
	 3 NAME3			 3	    2 DATABASE
	 4 NAME4			 4	    1 DATABASE

8 rows selected.

SELECT DEPT_NO, COUNT(*) AS NUM_EMP FROM EMPLOYEE GROUP BY DEPT_NO;

   DEPT_NO    NUM_EMP
---------- ----------
	 1	    1
	 2	    1
	 4	    1
	 5	    1
	 3	    1

SELECT DEPT_NO, COUNT(*) AS NUM_EMP FROM EMPLOYEE GROUP BY DEPT_NO ORDER BY DEPT_NO;

   DEPT_NO    NUM_EMP
---------- ----------
	 1	    1
	 2	    1
	 3	    1
	 4	    1
	 5	    1
	 
UPDATE WORKSON SET P_NO=5 WHERE SSN=2;

3 rows updated.

SELECT * FROM WORKSON;

      P_NO	  SSN
---------- ----------
	 1	    1
	 5	    2
	 1	    4
	 5	    2
	 2	    3
	 3	    3
	 3	    4
	 3	    5
	 4	    1
	 5	    2
	 4	    3

      P_NO	  SSN
---------- ----------
	 5	    1
	 5	    4
	 5	    5

14 rows selected.