CREATE TABLE PART(PID INTEGER PRIMARY KEY, PNAME VARCHAR(30) NOT NULL, PCOLOR VARCHAR(10) NOT NULL);

Table created.

CREATE TABLE SUPPLIER(SID INTEGER PRIMARY KEY, SNAME VARCHAR(30) NOT NULL, SADDR VARCHAR(30) NOT NULL);

Table created.

CREATE TABLE SUPPLY(PID INTEGER, SID INTEGER, FOREIGN KEY(PID) REFERENCES PART(PID) ON DELETE CASCADE, FOREIGN KEY(SID) REFERENCES SUPPLIER(SID));

Table created.

INSERT INTO PART VALUES(1,'PART1','GREY');

1 row created.

INSERT INTO PART VALUES(2,'PART2','GREY');

1 row created.

INSERT INTO PART VALUES(3,'PART3','BLACK');

1 row created.

INSERT INTO PART VALUES(4,'PART4','SILVER');

1 row created.

INSERT INTO PART VALUES(5,'PART5','RED');

1 row created.

INSERT INTO SUPPLIER VALUES(1, 'SUPPLIER1', 'LOC1');

1 row created.

INSERT INTO SUPPLIER VALUES(2, 'SUPPLIER2', 'LOC2');

1 row created.

INSERT INTO SUPPLIER VALUES(3, 'SUPPLIER3', 'LOC1');

1 row created.

INSERT INTO SUPPLIER VALUES(4, 'SUPPLIER4', 'LOC3');

1 row created.

INSERT INTO SUPPLY VALUES(1,1);

1 row created.

INSERT INTO SUPPLY VALUES(1,2);

1 row created.

INSERT INTO SUPPLY VALUES(1,3);

1 row created.

INSERT INTO SUPPLY VALUES(1,4);

1 row created.

INSERT INTO SUPPLY VALUES(2,1);

1 row created.

INSERT INTO SUPPLY VALUES(2,3);

1 row created.

INSERT INTO SUPPLY VALUES(2,4);

1 row created.

INSERT INTO SUPPLY VALUES(3,2);

1 row created.

INSERT INTO SUPPLY VALUES(3,3);

1 row created.

INSERT INTO SUPPLY VALUES(3,4);

1 row created.

INSERT INTO SUPPLY VALUES(4,4);

1 row created.

INSERT INTO SUPPLY VALUES(5,1);

1 row created.

INSERT INTO SUPPLY VALUES(5,2);

1 row created.

INSERT INTO SUPPLY VALUES(5,3);

1 row created.

INSERT INTO SUPPLY VALUES(5,4);

1 row created.

SELECT * FROM PART;

       PID PNAME			  PCOLOR
---------- ------------------------------ ----------
	 1 PART1			  GREY
	 2 PART2			  GREY
	 3 PART3			  BLACK
	 4 PART4			  SILVER
	 5 PART5			  RED

SELECT * FROM SUPPLIER;

       SID SNAME			  SADDR
---------- ------------------------------ ------------------------------
	 1 SUPPLIER1			  LOC1
	 2 SUPPLIER2			  LOC2
	 3 SUPPLIER3			  LOC1
	 4 SUPPLIER4			  LOC3

SELECT * FROM SUPPLY;

       PID	  SID
---------- ----------
	 1	    1
	 1	    2
	 1	    3
	 1	    4
	 2	    1
	 2	    3
	 2	    4
	 3	    2
	 3	    3
	 3	    4
	 4	    4

       PID	  SID
---------- ----------
	 5	    1
	 5	    2
	 5	    3
	 5	    4

15 rows selected.

SELECT SUPPLIER.SNAME, PART.PID, PART.PNAME, PART.PCOLOR FROM SUPPLIER, PART, SUPPLY WHERE PART.PID=SUPPLY.PID AND SUPPLIER.SID=SUPPLY.SID AND SNAME='SUPPLIER1';

SNAME				      PID PNAME		  PCOLOR	
------------------------------ ---------- ----------
SUPPLIER1				1 PART1			GREY
SUPPLIER1				2 PART2			GREY
SUPPLIER1				5 PART5			RED



SELECT PART.PNAME, SUPPLIER.SNAME FROM PART, SUPPLIER, SUPPLY WHERE PART.PID=SUPPLY.PID AND SUPPLIER.SID=SUPPLY.SID AND PNAME='PART3';

PNAME			       SNAME
------------------------------ ------------------------------
PART3			       SUPPLIER2
PART3			       SUPPLIER3
PART3			       SUPPLIER4

SELECT PNAME, PID FROM PART WHERE PCOLOR='GREY';

PNAME				      PID
------------------------------ ----------
PART1					1
PART2					2

DELETE FROM PART WHERE PCOLOR='GREY';

2 rows deleted.

SELECT * FROM SUPPLY;

       PID	  SID
---------- ----------
	 3	    2
	 3	    3
	 3	    4
	 4	    4
	 5	    1
	 5	    2
	 5	    3
	 5	    4

8 rows selected.

